{
  "schema_version": "miskatonic.representation-problem-custody-receipt.v0.2",
  "receipt_id": "problem-custody-fam-neg-04-R2_ASSOCIATIVE_REGROUPED",
  "family_id": "fam-neg-04",
  "representation_stratum": "R2_ASSOCIATIVE_REGROUPED",
  "source_problem_id": "fam-neg-04-r0",
  "source_problem_digest": "7329c68e5d2e108c6bd4ffa7db553dbe2aaaac2919d0efa51b8c1550ab549c4f",
  "transformed_problem_id": "fam-neg-04-r2",
  "transformed_problem_digest": "ce741d60f2499c911f3a7131b2590e81e86288389cafa84489cfd90606590305",
  "source_initial_expression": "mul(mul(qd, 1), 1)",
  "source_initial_expression_digest": "59f586350fdca223a366ca261c67b8723619a20516c251ab10aac798fcafad9a",
  "transformed_initial_expression": "mul(qd, mul(1, 1))",
  "transformed_initial_expression_digest": "6334004b96803898143ecdc7241fee815353147bb6af1e6e03abaf19af9b4e40",
  "source_goal_expression": "qd",
  "source_goal_digest": "e0ade89729e19c8a351bcc4dc0557b4cf0ba7f247eef3938ef19c76a04cc3f08",
  "transformed_goal_expression": "qd",
  "transformed_goal_digest": "e0ade89729e19c8a351bcc4dc0557b4cf0ba7f247eef3938ef19c76a04cc3f08",
  "variable_bijection": {
    "qd": "qd"
  },
  "transform_parameters": {
    "stratum": "R2_ASSOCIATIVE_REGROUPED"
  },
  "transform_implementation_digest": "5c85f28d268f138ffbf2ec8d9fe400d72a1378ed09223ddff43a802ccd809d4a",
  "original_v0_1_transform_receipt_ref": "experiments/formal-discovery-01c/receipts/transform-fam-neg-04-R2_ASSOCIATIVE_REGROUPED.json",
  "original_v0_1_transform_receipt_digest": "20de4ec3848809b641af0a589d58ad0b2a7d3014b7fb09d581da220f8b199189",
  "original_initial_semantics_smt_ref": "experiments/formal-discovery-01c/receipts/smt-transform-fam-neg-04-R2_ASSOCIATIVE_REGROUPED.json",
  "original_initial_semantics_smt_digest": "8d9929f1d2a6b49916218fcf35a6bd638bfb192f23b48a4ef7c64ef0613f93b2",
  "whole_problem_semantics_smt_ref": "experiments/formal-discovery-01c-r1/receipts/smt-whole-problem-fam-neg-04-R2_ASSOCIATIVE_REGROUPED.json",
  "whole_problem_semantics_smt_digest": "baf51cdef121b20cd557afef30f6cab879fd390d1ebee7300cabc10639f60c6a",
  "authority": "NONE",
  "receipt_digest": "a50b591582438b6b85bd4f70c4cdd7ef0f9f05818477e6b3a9b20939a44171b1"
}