{
  "schema_version": "miskatonic.representation-problem-custody-receipt.v0.2",
  "receipt_id": "problem-custody-fam-pos-03-R1_ALPHA_RENAMED",
  "family_id": "fam-pos-03",
  "representation_stratum": "R1_ALPHA_RENAMED",
  "source_problem_id": "fam-pos-03-r0",
  "source_problem_digest": "1cc11bde5765c5c4d490240ff03dd1cd0fd73e9f8109850e5396443f5506162e",
  "transformed_problem_id": "fam-pos-03-r1",
  "transformed_problem_digest": "4b62bc10492d6e1dfbffb3e3ffe8a3924a0e9a237b25d53c82b27a65b662197a",
  "source_initial_expression": "mul(1, mul(1, add(mul(1, kc), 0)))",
  "source_initial_expression_digest": "5b03a8ed6757386d743807bca2f39ff099716ea3b6c0ba70f89dee9e0e8f6efc",
  "transformed_initial_expression": "mul(1, mul(1, add(mul(1, alpha_kc), 0)))",
  "transformed_initial_expression_digest": "bd41ab5e155ab652d6243449963600065a56602deba1c5fe3105a6d69dcda67b",
  "source_goal_expression": "kc",
  "source_goal_digest": "ad9cdbefb70da610b07dcc613934052a0996f5c0da58a2d9632ec966361de506",
  "transformed_goal_expression": "alpha_kc",
  "transformed_goal_digest": "5705a87fe3b73f43840aea9973f718146718847390a93e519a4f5350e1aecf07",
  "variable_bijection": {
    "kc": "alpha_kc"
  },
  "transform_parameters": {
    "stratum": "R1_ALPHA_RENAMED"
  },
  "transform_implementation_digest": "5c85f28d268f138ffbf2ec8d9fe400d72a1378ed09223ddff43a802ccd809d4a",
  "original_v0_1_transform_receipt_ref": "experiments/formal-discovery-01c/receipts/transform-fam-pos-03-R1_ALPHA_RENAMED.json",
  "original_v0_1_transform_receipt_digest": "7df8eec3552ae18ccdb32e8831701ea38e246a1d4dc2ae58ae7adeae33bb7108",
  "original_initial_semantics_smt_ref": "experiments/formal-discovery-01c/receipts/smt-transform-fam-pos-03-R1_ALPHA_RENAMED.json",
  "original_initial_semantics_smt_digest": "d397c6ad98df247773040322e6c3ac3c3011e175ca9ba657dc5ceb9d44583432",
  "whole_problem_semantics_smt_ref": "experiments/formal-discovery-01c-r1/receipts/smt-whole-problem-fam-pos-03-R1_ALPHA_RENAMED.json",
  "whole_problem_semantics_smt_digest": "a8e35c843b2a2f6668f00e814548b9a423758312c5756f7b7e54325ebe67920f",
  "authority": "NONE",
  "receipt_digest": "333185fc6b8272fa7120695c1881f64eddcb1ce6aedbec64b1d16750b585d1e6"
}